name,tag,year,path,description
QEC autofiller,python,2026,python/qec-automated.py,Automatically fills QEC feedback form in three clicks using python
nyxtudes index,hidden,2026,python/nyxtudes.py,Generate index for README using this csv (norvig/pytudes)
testing marimo,puzzle,2024,notebooks/test.py,Dummy test file to test some stuff 😊 (source: marimo tutorial ui)
testing manim,calculus,2024,python/BasicExample.py,Dummy test file to test some stuff 😊 (source: manim-slides.eertmans.be)
testing manim2,manim,2024,python/Convert.py,Dummy test file to test more stuff 😊 (source: manim-slides.eertmans.be)
